Terrarosa topraklarý hangi bölgemizde daha sýk görülür|hangi bölgemizde||LOCATION|REGION.LOCAL|Akdeniz
Yýllýk yaðýþ miktarýnýn az olduðu kireçli topraklara ne ad verilir|kireçli topraklara ad||DESCRIPTION|DEFINITION|Kahverengi bozkýr topraklar
Kestane renkli bozkýr topraklarýnýn olduðu bir yörede yýllýk yaðýþ miktarý ne kadardýr|yaðýþ miktarý ne kadardýr||NUMERIC|SIZE.HEIGHT|400mm 600mm
Çayýr bitki örtüsü çevresinde oluþan topraklara ne ad verilir|topraklara ad||DESCRIPTION|DEFINITION|Çerezyom
Sürülmesi ve iþlenmesi zor, kil oraný fazla olan topraklara ne isim verilir|topraklara isim||DESCRIPTION|DEFINITION|Vertisol
Ege, iç anadolu ve doðu anadolunun çöküntülü kýsýmlarýnda yaygýn olan üst kýsmý kireçli topraklara ne denir|üst kýsmý kireçli topraklara denir||DESCRIPTION|DEFINITION|Rendzina
Akarsularýn taþýyýp biriktirdiði malzemelerden oluþan topraða ne denir|topraða denir||DESCRIPTION|DEFINITION|Alüvyal toprak
Daðlýk alanlarda yamaçlar boyunca ufalanan çeþitli malzemelerin, daðlarýn eteklerinde birikmesiyle oluþan topraklara ne ad verilir|topraklara ad||DESCRIPTION|DEFINITION|Kolüvyal toprak
Volkanlardan çýkan kum boyutundaki malzemeler ile yamaç eteklerindeki kolüvyal depolar üzerinde oluþan topraklara ne denir|topraklara denir||DESCRIPTION|DEFINITION|Regosol
Türkiye arazisinin yüzde kaçýnda tarým yapýlmaktadýr|Türkiye arazisinin yüzde kaçýnda||NUMERIC|PERCENTAGE|0.36/%36/36%
Türkiyede yetiþtirilen tarým ürünlerinin çeþitliliði temelde neye baðlýdýr|neye baðlýdýr||DESCRIPTION|REASON|Ýklim çeþitliði
Türkiyede en çok yetiþtirilen tahýl ürünü nedir|tahýl ürünü||ENTITY|PLANT|Buðday
Çay hangi toprakta daha iyi yetiþir|hangi toprakta||ENTITY|OTHERS|Kireçsiz
Maki ve çalýlýklarýn yaygýn olduðu bölgelerde yapýlan hayvancýlýkta hangi hayvan daha yaygýndýr|hangi hayvan||ENTITY|OTHERS|Kýl keçisi
Bozkýrlarýn daha yoðun olduðu yörelerde hangi hayvan yetiþtiriciliði fazladýr|hangi hayvan yetiþtiriciliði||ENTITY|OTHERS|Koyun
Çayýrlarýn daha fazla görüldüðü bölgelerde hangi hayvan daha çok yetiþtirilir|hangi hayvan||ENTITY|OTHERS|Sýðýr
Dut aðaçlarýnýn yaygýn olduðu bölgelerde hangi hayvandan daha çok faydalanýlýr|hangi hayvandan||ENTITY|OTHERS|Ýpek böceði
Çam ormanlarýnýn daha fazla olduðu yörelerde görülen hayvancýlýk çeþidi nedir|hayvancýlýk çeþidi||ENTITY|OTHERS|Arýcýlýk
Seramik, porselen, çömlek, tuðla ve kiremit yapýmýnda ham madde olarak hangi toprak çeþidi kullanýlýr|hangi toprak çeþidi||ENTITY|OTHERS|Killi toprak
Türkiyede yaklaþýk kaç farklý bitki türü bulunmaktadýr|kaç bitki türü||NUMERIC|COUNT|20000
Türkiyedeki bitki çeþitlilðinin fazla olmasýnýn en önemli sebebi nedir|sebebi||DESCRIPTION|REASON|Ýklim
Sadece türkiyede bulunan ve dünyanýn baþka hiç bir yerinde görülmeyen bitkilere ne ad verilir|bitkilere ad||DESCRIPTION|DEFINITION|Endemik bitki
3. ve 4. Jeolojik zamanda oluþmuþ, günümüzde yetiþmesi imkansýz bitkilere ne denir|bitkilere denir||DESCRIPTION|DEFINITION|Relikt
Ülkemizin yüzde kaçý ormanlarla kaplýdýr|Ülkemizin yüzde kaçý||NUMERIC|PERCENTAGE|0.28/%28/28%
Aðaçlar yapraklarýnýn özelliklerine göre kaça ayrýlýrlar|Aðaçlar kaça ayrýlýrlar||NUMERIC|COUNT|2
Kýzýlçamýn dünyada en geniþ yayýlýþ alaný nerededir|yayýlýþ alaný nerededir||LOCATION|LOCATION|Türkiye
Sarýçam türkiyede daha çok nerede bulunur|nerede bulunur||LOCATION|REGION.LOCAL|Kuzey anadolu daðlarý
Kýzýlaðaç en fazla kaç metre yükseklikte görülür|kaç metre yükseklikte||NUMERIC|SIZE.HEIGHT|1000 metre
Ihlamur en fazla kaç metre yükseklikte görülür|kaç metre yükseklikte||NUMERIC|SIZE.HEIGHT|1000 metre
Karaçam ortalama hangi yüksekliklerde görülür|hangi yüksekliklerde||NUMERIC|SIZE.HEIGHT|1000-2000 metre
Göknar ortalama hangi yükseklerde görülür|hangi yükseklikte||NUMERIC|SIZE.HEIGHT|1000-1500 metre
Maki bitki örtüsünün ortalama boyu ne kadardýr|ortalama boyu ne kadardýr||NUMERIC|SIZE.HEIGHT|1-3 metre
Maki hangi iklime uygun bir bitki örtüsüdür|hangi iklime||ENTITY|OTHERS|Akdeniz
Karadeniz kýyýlarýnda ormanlarýn tahrip edildiði bölgelerde rastlanan çalýlara ne ad verilir|çalýlara ad||DESCRIPTION|DEFINITION|Psödomaki
Kurak bölgelerde ilkbahar yaðýþýyla yeþeren ve yazýn sararan ot topluluklarýna ne denir|ot topluluklarýna denir||DESCRIPTION|DEFINITION|Bozkýr
Türkiyenin iç kesimlerinde ormanlarýn tahrip edilmesiyle oluþan ve doðal olmayan bozkýr alanlarýna ne denir|bozkýr alanlarýna denir||DESCRIPTION|DEFINITION|Antropojen bozkýr
Ýlkbaharda yeþerip yaz boyu yeþil kalan ve bozkýrdan daha gür olan bitki örtüsüne ne denir|bitki örtüsüne denir||DESCRIPTION|DEFINITION|Alpin çayýr
Alpin çayýrlarda ne çeþit hayvancýlýk yapýlýr|ne çeþit hayvancýlýk||ENTITY|OTHERS|Büyükbaþ
Akarsularýn taþýdýklarý malzeme ile kendi önlerini kapatmalarý sonucu oluþan göllere ne ad verilir|göllere ad||DESCRIPTION|DEFINITION|Set gölleri
Toprak çeþitlerinden hangisinin tarýmsal verimliliði en fazladýr|Toprak çeþitlerinden hangisinin||ENTITY|OTHERS|Alüvyal
Türkiye ormanlarýnýn yüzde kaçý Karadeniz bölgesinde bulunur|Türkiye ormanlarýnýn yüzde kaçý||NUMERIC|PERCENTAGE|0.25/25%/%25
Türkiye ormanlarýnýn yüzde kaçý ege bölgesinde bulunur|Türkiye ormanlarýnýn yüzde kaçý||NUMERIC|PERCENTAGE|0,17
Can ve mal kayýplarýna neden olan doða olaylarýna ne denir|doða olaylarýna||DESCRIPTION|DEFINITION|Doðal afet
Doðal afetler oluþum nedenlerine göre kaça ayrýlýrlar|Doðal afetler kaça ayrýlýrlar||NUMERIC|COUNT|2
Doðal afetler geliþim hýzlarýna göre kaça ayrýlýrlar|Doðal afetler kaça ayrýlýrlar||NUMERIC|COUNT|2
Yer kabuðunda meydana gelen ani ve kýsa süreli sarsýntýlara ne ad verilir|sarsýntýlara ad||DESCRIPTION|DEFINITION|Deprem
Depremler oluþumlarýna göre kaça ayrýlýr|Depremler kaça ayrýlýr||NUMERIC|COUNT|3
Dünyada en fazla deprem hangi deprem kuþaðýnda meydana gelir|hangi deprem kuþaðýnda||ENTITY|OTHERS|Büyük okyanus
Büyük okyanus deprem kuþaðýnda dünya depremlerinin yüzde kaçý meydana gelir|dünya depremlerinin yüzde kaçý||NUMERIC|PERCENTAGE|0.68/68%/%68
Alp-Himalaya kuþaðýnda dünyadaki depremlerin yüzde kaçý meydana gelir|depremlerin yüzde kaçý||NUMERIC|PERCENTAGE|0.25/%25/25%
Ülkemizde þu an faal durumda olan kaç organize sanayi vardýr|kaç organize sanayi||NUMERIC|COUNT|100 civarý
Bolu otoyol tüneli hangi projenin bir parçasýdýr|hangi projenin||ENTITY|OTHERS|Bolu Daðý Geçiþi Projesi
Kara Yollarý Genel Müdürlüðü ne zaman kurulmuþtur|ne zaman kurulmuþtur||TEMPORAL|DATE|1950
KGM neyin kýsaltmasýdýr|neyin kýsaltmasýdýr||ABBREVIATION|EXPRESSION|Kara Yollarý Genel Müdürlüðü
Bir limanýn iç bölgelerle olan ulaþým baðlantýsý özelliðine ne denir|ulaþým baðlantýsý özelliðine denir||DESCRIPTION|DEFINITION|Hinterlant
Hinterlant'ýn diðer adý nedir|Hinterlantýn adý||ENTITY|OTHERS|Art bölge
Ülkemizin en iþlek limaný hangisidir|Ülkemizin limaný||ENTITY|OTHERS|Ýstanbul limaný
BTC nedir|BTC||ABBREVIATION|EXPRESSION|Bakü-Tiflis-Ceyhan Boru Hattý
Mavi Akým Projesi hangi tarihte tamamlanmýþtýr|hangi tarihte||TEMPORAL|DATE|2002
Hazar-Türkiye-Avrupa Doðal gaz hattý hangi proje kapsamýnda ilerlemektedir|hangi proje kapsamýnda||ENTITY|OTHERS|Nabuco Projesi
Üretilen mal ve hizmetlerin alýnýp satýlmasýna ne denir|alýnýp satýlmasýna denir||DESCRIPTION|DEFINITION|Ticaret
Milet Amfi Tiyatrosu hangi ildedir|hangi ildedir||LOCATION|CITY|Aydýn
Milet Amfi Tiyatrosu hangi ilçededir|hangi ilçededir||LOCATION|CITY|Söke
Efes'i yýlda ortalama kaç kiþi ziyaret etmektedir|kaç kiþi||NUMERIC|SIZE.POPULATION|1.5 Milyon kiþi
Ülkemizde kaç ilde kaplýca bulunmaktadýr|kaç ilde||NUMERIC|COUNT|46
Ülkemizdeki 2010 yýlýnda toplam turist sayýsý ne kadardýr|toplam turist sayýsý ne kadardýr||NUMERIC|SIZE.POPULATION|28.632.204
Turizm teþvik kanunu ne zaman çýkmýþtýr|ne zaman çýkmýþtýr||TEMPORAL|DATE|1982
Türsab nedir|Türsab||ABBREVIATION|EXPRESSION|Türkiye Seyahat Acenteleri Birliði
Avrupa'da endemik bitki sayýsý toplamý ne kadardýr|endemik bitki sayýsý toplamý ne kadardýr||NUMERIC|COUNT|2750
Türkiye'de endemik bitki kaç adettir|endemik bitki sayýsý kaç adettir||NUMERIC|COUNT|3000
Karain maðarasý hangi ilin sýnýrlarý içerisindedir|hangi ilin||LOCATION|CITY|Antalya
Yere Batan Sarnýcý kim tarafýndan yaptýrýlmýþtýr|kim tarafýndan||HUMAN|INDIVIDUAL|I.Jüstinyen
Yere Batan Sarnýcý hangi tarihler arasýnda yaptýrýlmýþtýr|hangi tarihler arasýnda||TEMPORAL|DATE|532-537 yýllarý
Ayasofya kim tarafýndan camiye dönüþtürülmüþtür|kim tarafýndan||HUMAN|INDIVIDUAL|Fatih Sultan Mehmet
Ayasofya günümüzde ne olarak hizmet vermektedir|ne olarak||DESCRIPTION|REASON|Müze
TSE ne demektir|TSE||ABBREVIATION|EXPRESSION|Türk Standartlarý Enstitüsü
TSE ne zaman kurulmuþtur|ne zaman kurulmuþtur||TEMPORAL|DATE|1954
TSE baðýmsýz bir kamu kuruluþuna ne zaman dönüþmüþtür|ne zaman dönüþmüþtür||TEMPORAL|DATE|1960
Hýzlý Tren projesi kapsamýnda Ankara-Ýstanbul arasý yolculuk süresinin kaç saat olmasý beklenmektedir|kaç saat||NUMERIC|COUNT|3 Saat
2010 yýlý verilerine göre ülkemizdeki otoyol uzunluðu ne kadardýr|otoyol uzunluðu ne kadardýr||NUMERIC|SIZE.LENGTH|2080 km
Türkiye'de ilk þeker fabrikasý hangi tarihte kurulmuþtur|hangi tarihte||TEMPORAL|DATE|1926
Ülkemizde hangi bölge dýþýnda bütün bölgelerde þeker fabrikasý vardýr|hangi bölge dýþýnda||LOCATION|REGION.LOCAL|Güneydoðu Anadolu
Türkiye'de birinci beþ yýllýk sanayi alaný hangi tarihte yürürlüðe konmuþtur|hangi tarihte||TEMPORAL|DATE|1933
Sanayi’nin diðer adý nedir|Sanayinin adý||ENTITY|OTHERS|Endüstri
Oltu taþý hangi ilimizde çýkarýlmaktadýr|hangi ilimizde||LOCATION|CITY|Erzurum
Kütahya’nýn hangi ilçesinde feldispat yataklarý mevcuttur|Kütahyanýn hangi ilçesinde||LOCATION|CITY|Simav
Hýzla akan suyun, elektrik üreten türbinleri çalýþtýrmasý ile oluþan enerji ne enerjisidir|ne enerjisidir||DESCRIPTION|DEFINITION|Hidroelektrik enerjisi
Ýzmir Ýktisat kongresi kimin teþviki ile olmuþtur|kimin teþviki ile||HUMAN|INDIVIDUAL|Mustafa Kemal Atatürk
Türkiye'deki kültür balýkçýlýðý hangi iki balýk üzerine yoðunlaþmýþtýr|hangi iki balýk||ENTITY|OTHERS|Alabalýk sazan
Türkiye Sanayi ve Maden Bankasý hangi tarihte kurulmuþtur|hangi tarihte||TEMPORAL|DATE|1923
Tiftik keçisi ne olarak da bilinir|ne olarak da||ENTITY|OTHERS|Ankara Keçisi
Koyun ve keçi gibi hayvanlarýn genel adý nedir|hayvanlarýn genel adý||ENTITY|OTHERS|Küçükbaþ hayvan
Ýpek böceði yetiþtirme ve ondan koza elde etme iþine ne ad verilir|iþine ad||DESCRIPTION|DEFINITION|Ýpek böcekçiliði
Ýpek böcekçiliði en çok hangi bölgemizde yapýlmaktadýr|hangi bölgemizde||LOCATION|REGION.LOCAL|Marmara
Ýpek böceði daha çok hangi aðacýn yapraklarý ile beslenir|hangi aðacýn||ENTITY|PLANT|Dut aðacý
Anzer balý hangi ilimize özgüdür|hangi ilimize||LOCATION|CITY|Rize
Denizlerden üretilen balýk üretiminin yüzde kaçý Karadeniz bölgesinden karþýlanýr|balýk üretiminin yüzde kaçý||NUMERIC|PERCENTAGE|0.67/67%/%67
Tek sývý maden hangisidir|Tek sývý maden||ENTITY|SUBSTANCE|Civa
Türkiye hangi deprem kuþaðýnda yer almaktadýr|hangi deprem kuþaðýnda||ENTITY|OTHERS|Alp himalaya
Türkiyede kaç tane deprem bölgesi vardýr|kaç tane deprem bölgesi||NUMERIC|COUNT|3
Topraðýn belirli bir süre için tamamen veya kýsmen aniden su altýnda kalmasýna ne denir|su altýnda kalmasýna denir||DESCRIPTION|DEFINITION|Sel
Sel sularýnýn akarsu yataðýnýn dýþýna çýkarak tarým alanlarýna taþmasýna ne denir|taþmasýna denir||DESCRIPTION|DEFINITION|Taþkýn
Dünyada sel felaketleri en çok nerede yaþanýr|nerede yaþanýr||LOCATION|LOCATION|Güney asya
Bangladeþte dünyada görülen sel felaketlerinin yüzde kaçý meydana gelir|sel felaketlerinin yüzde kaçý||NUMERIC|PERCENTAGE|0.65/%65/65%
Türkiyede yýlda ortalama kaç adet sel felaketi olmaktadýr|kaç adet sel felaketi||NUMERIC|AVERAGE|23
Uzun bir zaman içinde yaðýþýn belirgin bir þekilde normal deðerlerin altýna düþmesine ne denir|düþmesine denir||DESCRIPTION|DEFINITION|Kuraklýk
Toprak yüzeyinin akarsular, sel sularý ve rüzgar gibi dýþ kuvvetler tarafýndan aþýndýrýlarak taþýnmasýna ne denir|taþýnmasýna denir||DESCRIPTION|DEFINITION|Erozyon
Yamaç boyunca taþ, kum ve toprak tabakalarýnýn yer deðiþtirmesi olayýna ne denir|yer deðiþtirmesi olayýna denir||DESCRIPTION|DEFINITION|Kütle hareketi
Eðimli yamaçlarda fazla yaðýþlarla doygun hale gelen topraðýn adeta bir hamur gibi yamaç boyunca kaymasýna ne denir|kaymasýna denir||DESCRIPTION|DEFINITION|Heyelan
Toprak kaymalarýný harekete geçiren en önemli faktör nedir|faktör||DESCRIPTION|REASON|Yer çekimi
Karadeniz kýyýlarýnýn yüzde kaçý heyelan riski taþýr|Karadeniz kýyýlarýnýn yüzde kaçý||NUMERIC|PERCENTAGE|0.89/%89/89%
Türkiyede heyelan olaylarý en çok hangi mevsimde olur|hangi mevsimde||TEMPORAL|SEASON|Ýlkbahar
Kar örtüsünün hýzlý bir þekilde eðim yönünde hareket etmesine ne denir|hareket etmesine denir||DESCRIPTION|DEFINITION|Çýð
Rüzgarýn hýzý kaç kilometrenin üzerine çýkarsa fýrtýna denir|kaç kilometrenin üzerine||NUMERIC|SPEED|63 km
Kasýrgalarýn saattaki ortalama hýzlarý kaçtýr|hýzlarý kaçtýr||NUMERIC|SPEED|120 km
Hýzlý bir þekilde dönen hava kolonlarýnýnýn buluduðu fýrtýna sistemine ne ad verilir|fýrtýna sistemine ad||ENTITY|OTHERS|Hortum
Yeryüzünde en þiddetli kasýrgalar hangi kuþakta görülür|hangi kuþakta||ENTITY|OTHERS|Tropikal
Yeryüzüne yaklaþýk olarak kaç adet aktif volkan vardýr|kaç adet aktif volkan||NUMERIC|COUNT|500
Dünyadaki aktif volkanlar en fazla hangi bölgede konumlanmýþtýr|hangi bölgede||LOCATION|REGION|Büyük okyanus çevresi
Depremler nedeniyle okyanus kýyýlarýnda oluþan dev dalgalara ne ad verilir|dev dalgalara ad||DESCRIPTION|DEFINITION|Tsunami
Türkiyede en fazla can kaybýna yol açan doðal afetin adý nedir|doðal afetin adý||ENTITY|OTHERS|Deprem
Kar yaðýþlarýnýn fazla, arazinin engebeli olduðu bölgelerde hangi doðal afet daha fazla görülür|hangi doðal afet||ENTITY|OTHERS|Çýð
Türkiyenin en doðu ile en batý ucu arasýnaki zaman farký kaçtýr|zaman farký kaçtýr||NUMERIC|COUNT|76 dk
Türkiyenin ortalama yüz ölçümü ne kadardýr|yüz ölçümü ne kadardýr||NUMERIC|SIZE.AREA|814.000 km2
Aðrý daðýnýn yüksekliði yaklaþýk kaç metredir|kaç metredir||NUMERIC|SIZE.HEIGHT|5100 m
Kýzýlýrmak nehrinin uzunluðu kaç metredir|kaç metredir||NUMERIC|SIZE.LENGTH|1350 m
Türkiyenin kara sýnýrlarýnýn toplam uzunluðu ne kadardýr|toplam uzunluðu ne kadardýr||NUMERIC|SIZE.LENGTH|2753 km
Türkiyenin suriye ile olan sýnýrýnýn uzunluðu ne kadardýr|uzunluðu ne kadardýr||NUMERIC|SIZE.LENGTH|877 km
Türkiyenin iran ile olan sýnýrýnýn uzunluðu ne kadardýr|uzunluðu ne kadardýr||NUMERIC|SIZE.LENGTH|454 km
Türkiyenin Irak ile olan sýnýrýnýn uzunluðu kaç kilometredir|kaç kilometredir||NUMERIC|SIZE.LENGTH|331 km
Türkiyenin Ermenistan ile olan sýnýrýnýn uzunluðu kaç kilometredir|kaç kilometredir||NUMERIC|SIZE.LENGTH|316 km
Türkiyenin Yunanistan ile olan sýnýrýnýn uzunluðu kaç kilometredir|kaç kilometredir||NUMERIC|SIZE.LENGTH|212 km
Türkiyenin en büyük adasý hangisidir|adasý||LOCATION|CITY|Gökçeada
Gökçeadanýn yüz ölçümü kaç kilometre karedir|kaç kilometre karedir||NUMERIC|SIZE.AREA|279 km2
Türkiyenin en büyük baraj gölünün adý nedir|baraj gölünün adý||ENTITY|OTHERS|Atatürk
Atatürk baraj gölünün büyüklüðü ne kadardýr|büyüklüðü ne kadardýr||NUMERIC|SIZE.AREA|817 km2
Türkiyenin en doðu ucu ile en batý ucu arasýndaki uzaklýk ne kadardýr|uzaklýk ne kadardýr||NUMERIC|SIZE.LENGTH|1565 km
Türkiyenin yüzölçümü olarak en büyük bölgesi hangisidir|bölgesi||LOCATION|REGION.LOCAL|Doðu anadolu bölgesi
Doðu anadolu bölgesinin yüz ölçümü yaklaþýk ne kadardýr|yüz ölçümü yaklaþýk ne kadardýr||NUMERIC|SIZE.AREA|163.000 km2
Doðu anadolu bölgesinde kaç bölüm vardýr|kaç bölüm||NUMERIC|COUNT|4
Doðu anadolu bölgesinin nüfusu ortalama ne kadardýr|nüfusu ne kadardýr||NUMERIC|SIZE.POPULATION|6147000
Fýrat sularýný nereye döker|nereye döker||LOCATION|LOCATION|Basra körfezi
Dicle sularýný nereye döker|nereye döker||LOCATION|LOCATION|Basra körfezi
Kura nehri sularýný nereye döker|nereye döker||LOCATION|LOCATION|Hazar denizi
Doðu anadolu bölgesinde kaç il vardýr|kaç il||NUMERIC|COUNT|14
Doðu anadolu bölgesinin en kalabalýk nüfusa sahip olan ili hangisidir|ili||LOCATION|CITY|Erzurum
Erzurumun nüfusu yaklaþýk ne kadardýr|nüfusu ne kadardýr||NUMERIC|SIZE.POPULATION|780000
Türkiyenin nüfus yoðunluðu en az olan bölgesi hangisidir|bölgesi||LOCATION|REGION.LOCAL|Doðu anadolu
Birleþmiþ milletler hangi tarihte kurulmuþtur|hangi tarihte||TEMPORAL|DATE|29 ekim 1945
Birleþmiþ milletler teþkilatýnýn kaç üyesi bulunmaktadýr|kaç üyesi||NUMERIC|COUNT|179
Birleþmiþ milletler bünyesinde tartýþma ve karar organý olan yapýnýn adý nedir|yapýnýn adý||DESCRIPTION|DEFINITION|Genel kurul
Birleþmiþ milletler genel kurulu yýlda kaç kez olaðan toplanýr|kaç kez||NUMERIC|COUNT|1
Birleþmiþ milletler güvenlik konseyi kaç üyeden oluþur|kaç üyeden||NUMERIC|COUNT|15
Birleþmiþ milletler güvenlik konseyi ne sýklýkta toplanýr|ne sýklýkta||NUMERIC|PERCENTAGE|Ayda bir
Birleþmiþ milletler uluslararasý adalet divaný kaç üyeden oluþmaktadýr|kaç üyeden||NUMERIC|COUNT|15
Birleþmiþ milletler uluslararasý adalet divanýnýn merkezi hangi ülkededir|hangi ülkededir||LOCATION|COUNTRY|Hollanda Lahey
Birleþmiþ milletler bünyesinde sömürge topraklarýyla ilgilenen alt kurulun adý nedir|alt kurulun adý||DESCRIPTION|DESCRIPTION|Vesayet konseyi
Birleþmiþ milletler ekonomik ve sosyal konseyi kaç üyeden oluþur|kaç üyeden||NUMERIC|COUNT|54
Birleþmiþ milletler teþkilatýnýn en üst organý olan yapýnýn adý nedir|yapýnýn adý||DESCRIPTION|DEFINITION|Genel sekreterlik
UNESCO'nun türkçe açýlýmý nedir|açýlýmý||ABBREVIATION|EXPRESSION|BM bilim ve kültür örgütü
FAO'nun türkçe açýlýmý nedir|açýlýmý||ABBREVIATION|EXPRESSION|BM gýda ve tarým örgütü
WHO'nun türkçe açýlýmý nedir|açýlýmý||ABBREVIATION|EXPRESSION|Dünya saðlýk örgütü
ILO'nun türkçe açýlýmý nedir|açýlýmý||ABBREVIATION|EXPRESSION|Uluslararasý çalýþma örgütü
IMF'nin türkçe açýlýmý nedir|açýlýmý||ABBREVIATION|EXPRESSION|Uluslararasý para fonu
OPEC'in türkçe açýlýmý nedir|açýlýmý||ABBREVIATION|EXPRESSION|Petrol ihraç eden ülkeler örgütü
NATO'nun türkçe açýlýmý nedir|açýlýmý||ABBREVIATION|EXPRESSION|Kuzey atlantik antlaþmasý örgütü
NATO'nun kurucu üye sayýsý kaçtýr|kurucu üye sayýsý kaçtýr||NUMERIC|COUNT|12
NATO kaç yýlýnda kurulmuþtur|kaç yýlýnda kurulmuþtur||TEMPORAL|DATE|1949
NATO'nun en büyük sivil organý nedir|sivil organý||DESCRIPTION|DEFINITION|Kuzey atlantik konseyi
NATO'nun en yüksek askeri organý nedir|askeri organý||DESCRIPTION|DEFINITION|Askeri komite
OECD'nin türkçe açýlýmý nedir|açýlýmý||ABBREVIATION|EXPRESSION|Ekonomik kalkýnma ve iþ birliði örgütü
OECD ne zaman kurulmuþtur|ne zaman kurulmuþtur||TEMPORAL|DATE|1948
Türkiye OECD'ye ne zaman üye olmuþtur|ne zaman üye olmuþtur||TEMPORAL|DATE|1948
OPEC ne zaman kurulmuþtur|ne zaman kurulmuþtur||TEMPORAL|DATE|1960
IMF ne zaman kurulmuþtur|ne zaman kurulmuþtur||TEMPORAL|DATE|1944
IMF'nin kaç tane kurucu üyesi vardýr|kaç tane kurucu üyesi||NUMERIC|COUNT|44
IMF'de en fazla oy hakký olan ülke hangisidir|ülke||LOCATION|COUNTRY|Amerika birleþik devletleri
Dünya bankasý kaç yýlýnda kurulmuþtur|kaç yýlýnda||TEMPORAL|DATE|1945
G-8 ülkeleri hangi yýldan beri faaliyet göstermektedirler|hangi yýldan beri||TEMPORAL|DATE|1975
G-20 ülkeleri ne zaman kurulmuþtur|ne zaman kurulmuþtur||TEMPORAL|DATE|25 eylül 1999
Greenpeace örgütü ne zaman kurulmuþtur|ne zaman kurulmuþtur||TEMPORAL|DATE|1971
Greenpeace türkiyede ilk ofisini ne zaman açmýþtýr|ne zaman açmýþtýr||TEMPORAL|DATE|1991
Avrupa birliði ne zaman kurulmuþtur|ne zaman kurulmuþtur||TEMPORAL|DATE|25 mart 1957
Türkiye hangi yýl avrupa birliðine aday ülke olarak açýklanmýþtýr|hangi yýl||TEMPORAL|DATE|1999
Türkiye AB müzakerelerine ne zaman baþlamýþtýr|ne zaman baþlamýþtýr||TEMPORAL|DATE|3 ekim 2005
KEÝ'nin açýlýmý nedir|açýlýmý||ABBREVIATION|EXPRESSION|Karadeniz ekonomik iþbirliði teþkilatý
KEÝ ne zaman kurulmuþtur|ne zaman kurulmuþtur||TEMPORAL|DATE|25 haziran 1992
NAFTA'nýn türkçe açýlýmý nedir|açýlýmý||ABBREVIATION|EXPRESSION|Kuzey amerika  serbest ticaret birliði
AGÝT'in açýlýmý nedir|açýlýmý||ABBREVIATION|EXPRESSION|Avrupa güvenlik ve iþbirliði teþkilatý
AGÝT hangi yýl çalýþmalarýna baþlamýþtýr|hangi yýl||TEMPORAL|DATE|1973
Türkiye AGÝT'e kaç yýlýnda üye olmuþtur|kaç yýlýnda||TEMPORAL|DATE|1999
Dünydaki enerji kaynaklarýnýn yüzde kaçýný fosil yakýtlar oluþtumaktadýr|enerji kaynaklarýnýn yüzde kaçýný||NUMERIC|PERCENTAGE|80%/%80
Dünya üzerinde kaç adet çalýþýr durumda nükleer santral bulunmaktadýr|kaç adet nükleer santral||NUMERIC|COUNT|442
Dünya kullanýlan enerji kaynaklarýnýn yüzde kaçý yenilenebilir kaynaklardýr|enerji kaynaklarýnýn yüzde kaçý||NUMERIC|PERCENTAGE|14%/%14
Biyolojik her türlü atýktan elde edilebilecek olan enerjiye ne isim verilir|enerjiye isim||DESCRIPTION|DEFINITION|Biyoenerji
Dünya üzerinde ilk rüzgar türbini ne zaman kullanýlmýþtýr|ne zaman kullanýlmýþtýr||TEMPORAL|DATE|1890
Dünya üzerinde üretilen elektriðin yüzde kaçý hidroelektrik santrallerden üretilmektedir|elektriðin yüzde kaçý||NUMERIC|PERCENTAGE|17%
Çin toplam dünya kömür üretiminin yüzde kaçýný gerçekleþtirmektedir|kömür üretiminin yüzde kaçýný||NUMERIC|PERCENTAGE|30%
Rüzgar enerjisi hangi ülke tarafýndan keþfedilmiþtir|hangi ülke||LOCATION|COUNTRY|Danimarka
Yerin derinliklerindeki sýcaklýkla ilgili olan ve bu güçle ýsýnarak oluþan enerjiye ne denir|enerjiye denir||DESCRIPTION|DEFINITION|Jeotermal enerji
Dalgalarýn kabarma ve çekilme hareketlerinden yararlanýlarak üretilen enerjiye ne denir|enerjiye denir||DESCRIPTION|DEFINITION|Dalga enerjisi
Dünyanýn kýyý þeritlerindeki dalga enerjisi potansiyeli ortalama ne kadardýr|dalga enerjisi potansiyeli ne kadardýr||NUMERIC|AVERAGE|4milyon kwh
Gelgitin oluþturduðu okyanus veya deniz suyunun yükselme ve geri çekilme hareketlerinin kýyýlara kurulan türbinler sayesinde elektrik enerjisine çevrilmesine ne denir|elektrik enerjisine çevrilmesine denir||DESCRIPTION|DEFINITION|Gelgit enerjisi
Su gücünden elde edilen elektrik enerjisine ne denir|elektrik enerjisine denir||DESCRIPTION|DEFINITION|Hidroelektrik
Dünya üzerinde üretilen enerjinin yüzde kaçý hidroelektrik enerjisidir|enerjinin yüzde kaçý||NUMERIC|PERCENTAGE|17%
Ormanlar günümüzde yeryüzünün yüzde kaçýný kaplamaktadýr|yeryüzünün yüzde kaçýný||NUMERIC|PERCENTAGE|25%
Amazon ormanlarýnýn yayýlým alaný ne kadardýr|yayýlým alaný ne kadardýr||NUMERIC|SIZE.AREA|4.2 milyon km2
Petrol ürünlerinin kullanýlmasý sonucu havaya en çok yayýlan gazýn adý nedir|gazýn adý||ENTITY|OTHERS|Karbondioksit
Çernobil nükleer kazasý ne zaman gerçekleþmiþtir|ne zaman gerçekleþmiþtir||TEMPORAL|DATE|1986
Batmanýn günümüzde nüfusu kaçtýr|Batmanýn nüfusu kaçtýr||NUMERIC|SIZE.POPULATION|534000
Deprem, tsunami gibi doðal afetleri önceden haber veren sistemlere ne denir|sistemlere denir||DESCRIPTION|DEFINITION|Erken uyarý sistemleri
AKOM'un açýlýmý nedir|açýlýmý||ABBREVIATION|EXPRESSION|Afet koordinasyon merkezi
LIFE'nin türkçe açýlýmý nedir|açýlýmý||ABBREVIATION|EXPRESSION|Çevre projelerini destekleme programý
Ramsar sözleþmesi ilk ne zaman imzalanmýþtýr|ne zaman imzalanmýþtýr||TEMPORAL|DATE|1971
Türkiye ramsar sözleþmesini ne zaman imzalamýþtýr|ne zaman imzalanmýþtýr||TEMPORAL|DATE|1993
Milli parklar kanunu kaç yýlýnda çýkarýlmýþtýr|kaç yýlýnda||TEMPORAL|DATE|1983
Türkiyede kaç adet milli park vardýr|kaç adet milli park||NUMERIC|COUNT|33
Türkiyede kaç adet koruma alaný vardýr|kaç adet koruma alaný||NUMERIC|COUNT|4
Türkiyede kaç adet tabiat anýtý bulunmaktadýr|kaç adet tabiat anýtý||NUMERIC|COUNT|58
Türkiyede kaç adet tabiatý koruma alaný vardýr|kaç adet tabiatý koruma alaný||NUMERIC|COUNT|35
ÇED'in açýlýmý nedir|açýlýmý||ABBREVIATION|EXPRESSION|Çevresel etki deðerlendirmesi
ÇED türkiyede ne zamandan beri uygulanmaktadýr|ne zamandan beri||TEMPORAL|DATE|7 þubat 1993
EEA'nýn türkçe açýlýmý nedir|açýlýmý||ABBREVIATION|EXPRESSION|Avrupa çevre ajansý
EEA kaç yýlýnda kurulmuþtur|kaç yýlýnda||TEMPORAL|DATE|1990
EEA nýn kaç üyesi vardýr|kaç üyesi||NUMERIC|COUNT|32
Türkiye EEA'ya kaç yýlýnda üye olmuþtur|kaç yýlýnda||TEMPORAL|DATE|2003
UNEP'in türkçe açýlýmý nedir|açýlýmý||ABBREVIATION|EXPRESSION|Birleþmiþ milletler çevre programý
